{
  "type": "aos.employer_brand_live_evidence_capture_repair_promotion",
  "schema_version": "2026-05-employer-brand-live-evidence-capture-repair-promotion-v0",
  "id": "live-evidence-capture-repair-promotion:symphony-talent-phenom-radancy",
  "label": "Symphony Talent Employer Brand Live Evidence Capture Repair Promotion",
  "status": "repair_promoted_to_next_capture_attempt_plan",
  "source_refs": {
    "repair_patch_id": "live-evidence-capture-repair-patch:symphony-talent-phenom-radancy",
    "repair_patch_path": "live-evidence-capture-repair-patch.json",
    "repair_patch_application_id": "live-evidence-capture-repair-patch-application:symphony-talent-phenom-radancy",
    "repair_patch_application_path": "live-evidence-capture-repair-patch.application.json",
    "failure_review_pack_id": "live-evidence-capture-failure-review-pack:symphony-talent-phenom-radancy",
    "failure_review_pack_path": "live-evidence-capture-failure-review-pack.json",
    "manifest_id": "live-evidence-element-clip-manifest:symphony-talent-phenom-radancy",
    "manifest_path": "source-artifacts/live-evidence-element-clip-manifest.json",
    "reviewed_locator_capture_plan_id": "live-evidence-reviewed-locator-capture-plan:symphony-talent-phenom-radancy",
    "reviewed_locator_capture_plan_path": "live-evidence-reviewed-locator-capture-plan.json",
    "reviewed_locator_readiness_id": "live-evidence-locator-readiness-reviewed:symphony-talent-phenom-radancy",
    "reviewed_locator_readiness_path": "live-evidence-locator-readiness.reviewed.json",
    "url_open_run_id": "live-evidence-url-open-run:symphony-talent-phenom-radancy",
    "url_open_run_path": "live-evidence-url-open-run.json",
    "reviewed_target_plan_id": "live-evidence-reviewed-target-plan:symphony-talent-phenom-radancy",
    "reviewed_target_plan_path": "live-evidence-target-plan.reviewed.json",
    "data_bundle_id": "employer-brand-comparative-audit-data-bundle:symphony-talent-phenom-radancy",
    "data_bundle_path": "data-bundle.json",
    "read_only": true
  },
  "summary": {
    "repaired_executable_slot_count": 4,
    "unavailable_source_slot_count": 1,
    "previous_failed_executable_slot_count": 5,
    "read_only_context_entry_count": 14,
    "accepted_capture_count": 0,
    "promoted_capture_count": 0,
    "actual_capture_file_count": 0,
    "planned_output_slot_count": 4,
    "full_page_grab_count": 0
  },
  "promotion_results": [
    {
      "slot_id": "live-reviewed-capture-work-unit:symphony-talent-careers-site:slot:1",
      "failure_id": "live-evidence-capture-failure:1",
      "repair_item_id": "live-evidence-capture-repair:1",
      "result": "promoted_to_repaired_capture_slot",
      "executable": true,
      "repaired_locator": {
        "selector": "section#home-hero",
        "xpath": null,
        "playwright_locator": null
      },
      "capture_promoted": false
    },
    {
      "slot_id": "live-reviewed-capture-work-unit:symphony-talent-careers-site:slot:2",
      "failure_id": "live-evidence-capture-failure:2",
      "repair_item_id": "live-evidence-capture-repair:2",
      "result": "promoted_to_repaired_capture_slot",
      "executable": true,
      "repaired_locator": {
        "selector": "section#section-2-2583",
        "xpath": null,
        "playwright_locator": null
      },
      "capture_promoted": false
    },
    {
      "slot_id": "live-reviewed-capture-work-unit:phenom-careers-site:slot:1",
      "failure_id": "live-evidence-capture-failure:4",
      "repair_item_id": "live-evidence-capture-repair:4",
      "result": "promoted_to_repaired_capture_slot",
      "executable": true,
      "repaired_locator": {
        "selector": null,
        "xpath": null,
        "playwright_locator": "page.locator('main section').filter({ hasText: /AI for Tomorrow.*Applied by Human Resources/ }).first()"
      },
      "capture_promoted": false
    },
    {
      "slot_id": "live-reviewed-capture-work-unit:radancy-careers-site:slot:1",
      "failure_id": "live-evidence-capture-failure:5",
      "repair_item_id": "live-evidence-capture-repair:5",
      "result": "promoted_to_repaired_capture_slot",
      "executable": true,
      "repaired_locator": {
        "selector": "div.primary-hero",
        "xpath": null,
        "playwright_locator": null
      },
      "capture_promoted": false
    },
    {
      "slot_id": "live-reviewed-capture-work-unit:symphony-talent-linkedin-presence:slot:1",
      "failure_id": "live-evidence-capture-failure:3",
      "repair_item_id": "live-evidence-capture-repair:3",
      "result": "preserved_as_source_unavailable_context",
      "executable": false,
      "repaired_locator": {
        "selector": null,
        "xpath": null,
        "playwright_locator": null
      },
      "capture_promoted": false
    }
  ],
  "repaired_capture_plan_ref": {
    "id": "live-evidence-repaired-locator-capture-plan:symphony-talent-phenom-radancy",
    "path": "live-evidence-repaired-locator-capture-plan.json",
    "schema": "shared/schemas/employer-brand-live-evidence-repaired-locator-capture-plan-v0.schema.json",
    "status": "pre_capture_plan_ready_with_source_unavailable_context",
    "read_only": true
  },
  "repaired_capture_plan": {
    "type": "aos.employer_brand_live_evidence_repaired_locator_capture_plan",
    "schema_version": "2026-05-employer-brand-live-evidence-capture-repair-promotion-v0",
    "id": "live-evidence-repaired-locator-capture-plan:symphony-talent-phenom-radancy",
    "label": "Symphony Talent Employer Brand Live Evidence Repaired Locator Capture Plan",
    "status": "pre_capture_plan_ready_with_source_unavailable_context",
    "source_refs": {
      "repair_patch_id": "live-evidence-capture-repair-patch:symphony-talent-phenom-radancy",
      "repair_patch_path": "live-evidence-capture-repair-patch.json",
      "repair_patch_application_id": "live-evidence-capture-repair-patch-application:symphony-talent-phenom-radancy",
      "repair_patch_application_path": "live-evidence-capture-repair-patch.application.json",
      "failure_review_pack_id": "live-evidence-capture-failure-review-pack:symphony-talent-phenom-radancy",
      "failure_review_pack_path": "live-evidence-capture-failure-review-pack.json",
      "manifest_id": "live-evidence-element-clip-manifest:symphony-talent-phenom-radancy",
      "manifest_path": "source-artifacts/live-evidence-element-clip-manifest.json",
      "reviewed_locator_capture_plan_id": "live-evidence-reviewed-locator-capture-plan:symphony-talent-phenom-radancy",
      "reviewed_locator_capture_plan_path": "live-evidence-reviewed-locator-capture-plan.json",
      "reviewed_locator_readiness_id": "live-evidence-locator-readiness-reviewed:symphony-talent-phenom-radancy",
      "reviewed_locator_readiness_path": "live-evidence-locator-readiness.reviewed.json",
      "url_open_run_id": "live-evidence-url-open-run:symphony-talent-phenom-radancy",
      "url_open_run_path": "live-evidence-url-open-run.json",
      "reviewed_target_plan_id": "live-evidence-reviewed-target-plan:symphony-talent-phenom-radancy",
      "reviewed_target_plan_path": "live-evidence-target-plan.reviewed.json",
      "data_bundle_id": "employer-brand-comparative-audit-data-bundle:symphony-talent-phenom-radancy",
      "data_bundle_path": "data-bundle.json",
      "read_only": true
    },
    "summary": {
      "repaired_executable_slot_count": 4,
      "unavailable_source_slot_count": 1,
      "previous_failed_executable_slot_count": 5,
      "read_only_context_entry_count": 14,
      "accepted_capture_count": 0,
      "promoted_capture_count": 0,
      "actual_capture_file_count": 0,
      "planned_output_slot_count": 4,
      "full_page_grab_count": 0
    },
    "capture_ordering": {
      "strategy": "preserve_repair_patch_slot_order",
      "order_is_deterministic": true,
      "executable_slot_ids": [
        "live-reviewed-capture-work-unit:symphony-talent-careers-site:slot:1",
        "live-reviewed-capture-work-unit:symphony-talent-careers-site:slot:2",
        "live-reviewed-capture-work-unit:phenom-careers-site:slot:1",
        "live-reviewed-capture-work-unit:radancy-careers-site:slot:1"
      ],
      "stop_after_each_slot_for_human_review": true
    },
    "repaired_capture_slots": [
      {
        "slot_id": "live-reviewed-capture-work-unit:symphony-talent-careers-site:slot:1",
        "failure_id": "live-evidence-capture-failure:1",
        "repair_item_id": "live-evidence-capture-repair:1",
        "target_id": "live-target:symphony-talent:careers-site",
        "work_unit_id": "live-reviewed-capture-work-unit:symphony-talent-careers-site",
        "executable": true,
        "status": "repaired_locator_ready_for_capture_attempt",
        "repair_decision": "approve_repaired_locator",
        "company": "Symphony Talent",
        "company_role": "client",
        "source_category": "careers_site",
        "original_url": "https://www.symphonytalent.com/",
        "final_url": "https://www.symphonytalent.com/",
        "natural_language_target": "Human-selected careers homepage hero or EVP proof block that states the employer promise without capturing the full page.",
        "evidence_goal": "Confirm Symphony Talent career-site positioning and visible employee value proposition proof for KILOS scoring.",
        "kilos_relevance": [
          "impact",
          "opportunity"
        ],
        "expected_clip_count": 2,
        "original_failed_locator": {
          "selector": "[data-testid=\"hero-employer-brand\"], main section.hero",
          "xpath": null,
          "playwright_locator": null
        },
        "repaired_locator": {
          "selector": "section#home-hero",
          "xpath": null,
          "playwright_locator": null
        },